{
  "schemaVersion": 1,
  "documentType": "hosted-windows-capabilities",
  "sourceSha": "188a70ae6e0327acafd060a9f83fb32df7a1b54b",
  "runnerOs": "Windows",
  "runnerArch": "X64",
  "imageOs": "win25-vs2026",
  "osVersion": "10.0.26100.0",
  "processSessionId": 2,
  "userInteractive": true,
  "uiaAssembliesLoaded": true,
  "primaryDisplayWidth": 1024,
  "primaryDisplayHeight": 768,
  "displayProbeAvailable": true,
  "dpiProbeAvailable": true,
  "systemDpiX": 96,
  "systemDpiY": 96,
  "systemScalePercent": 100,
  "narratorObserved": false,
  "minimumFreeBytes": 5368709120,
  "actualFreeBytesAtProbe": 157831516160,
  "isolatedStorageRoundTrip": true,
  "cleanupVerified": true,
  "githubNetworkAllowed": true,
  "timeoutEnforced": true,
  "personalDataCollected": false,
  "secretValuesCollected": false
}
